{
  "opportunity_id": "opp_camping_fixture",
  "niche_id": "camping-fixture",
  "candidate": {
    "candidate_id": "nc-001",
    "title": "Portable camping fan",
    "product_hypothesis": "Compact rechargeable tent fan with honest runtime claims and low-noise motor"
  },
  "score": 0.72,
  "subscores": {
    "demand": 0.676,
    "growth": 0.583,
    "pain": 0.725,
    "competition": 0.57,
    "content": 0.59
  },
  "confidence": 0.65,
  "coverage_gaps": [],
  "hostile_dependent": false,
  "scored_from": [
    "sig_camping_demand",
    "sig_camping_growth",
    "sig_camping_pain",
    "sig_camping_competition",
    "sig_camping_content"
  ],
  "generating_queries": ["qsp_camping_fan"],
  "provenance": {
    "scoring_version": "score-1.0.0",
    "weights_version": "w-2026.07.21",
    "normalize_version": "normalize-1.0.0",
    "config_hash": "sha256:aaaaaaaaaaaaaaaaaaaaaaaaaaaaaaaaaaaaaaaaaaaaaaaaaaaaaaaaaaaaaaaa",
    "created_at": "2026-07-21T12:00:00Z"
  },
  "as_of": "2026-07-21T12:00:00Z",
  "schema_version": "opportunity.v1"
}
